{
  "$schema": "https://json-schema.org/draft/2020-12/schema",
  "$id": "https://github.com/Pi-Defi-world/Wpi/attestations/schema.json",
  "title": "WpiReserveAttestation",
  "description": "Signed off-chain proof-of-reserve attestation for wrapped Pi (wPi).",
  "type": "object",
  "required": [
    "schema_version",
    "issued_at",
    "network",
    "wpi_contract_id",
    "wpi_total_supply",
    "pi_custody_account",
    "pi_custody_balance",
    "pi_balance_source",
    "safety_margin_bps",
    "collateral_ratio",
    "status",
    "attestor_public_key",
    "signature",
    "signed_fields"
  ],
  "properties": {
    "schema_version": {
      "type": "string",
      "const": "1.0"
    },
    "issued_at": {
      "type": "string",
      "format": "date-time",
      "description": "UTC ISO-8601 timestamp when the attestation was created."
    },
    "network": {
      "type": "string",
      "enum": ["testnet", "public"]
    },
    "wpi_contract_id": {
      "type": "string",
      "description": "Stellar Soroban contract ID for wPi (C...)."
    },
    "wpi_total_supply": {
      "type": "string",
      "pattern": "^[0-9]+$",
      "description": "On-chain total_supply in stroops (7 decimals). Non-negative integer string only."
    },
    "pi_custody_account": {
      "type": "string",
      "description": "Identifier of the Pi Network custody account."
    },
    "pi_custody_balance": {
      "type": "string",
      "pattern": "^[0-9]+$",
      "description": "Reported Pi custody balance in stroops (7 decimals). Non-negative integer string only."
    },
    "pi_balance_source": {
      "type": "string",
      "description": "How pi_custody_balance was obtained (file, env, api, manual)."
    },
    "safety_margin_bps": {
      "type": "integer",
      "minimum": 0,
      "maximum": 10000
    },
    "collateral_ratio": {
      "type": "string",
      "description": "pi_custody_balance / wpi_total_supply (display; recompute on verify), or 'inf' if supply is 0."
    },
    "status": {
      "type": "string",
      "enum": ["healthy", "under_collateralized"],
      "description": "Derived status. Negative quantities are rejected rather than reported as unknown."
    },
    "attestor_public_key": {
      "type": "string",
      "pattern": "^[0-9a-fA-F]{64}$",
      "description": "Ed25519 public key (32 bytes hex)."
    },
    "signature": {
      "type": "string",
      "pattern": "^[0-9a-fA-F]{128}$",
      "description": "Ed25519 signature (64 bytes hex) over the canonical payload."
    },
    "signed_fields": {
      "type": "array",
      "description": "Immutable v1 ordered list of field names included in the signed canonical JSON.",
      "minItems": 9,
      "maxItems": 9,
      "prefixItems": [
        { "const": "schema_version" },
        { "const": "issued_at" },
        { "const": "network" },
        { "const": "wpi_contract_id" },
        { "const": "wpi_total_supply" },
        { "const": "pi_custody_account" },
        { "const": "pi_custody_balance" },
        { "const": "pi_balance_source" },
        { "const": "safety_margin_bps" }
      ],
      "items": false
    }
  },
  "additionalProperties": false
}
