{
  "schema_version": "1.0",
  "issued_at": "2026-07-17T15:49:36.620Z",
  "network": "testnet",
  "wpi_contract_id": "CDUMMYWPIRESERVEATTESTATIONPLACEHOLDER000000000000000000",
  "wpi_total_supply": "1000000000000",
  "pi_custody_account": "pi_custody_demo_account_001",
  "pi_custody_balance": "1000000000000",
  "pi_balance_source": "manual",
  "safety_margin_bps": 0,
  "collateral_ratio": "1.00000000",
  "status": "healthy",
  "attestor_public_key": "03254a056f4ac1c634fbae6dfeb393b468d8d05758b07260311334316eec89bb",
  "signature": "97c7d8f4f9217a9852ddcd993d080549fd22ea8466f8e0bb9c59e8f9fc608f1b5cdcd8f8a3377a4e18879e872def127e331bbe100424bd41fdac2f94a490bb04",
  "signed_fields": [
    "schema_version",
    "issued_at",
    "network",
    "wpi_contract_id",
    "wpi_total_supply",
    "pi_custody_account",
    "pi_custody_balance",
    "pi_balance_source",
    "safety_margin_bps"
  ]
}
